{
  "P_parallel": [
    [
      0.6324555320336759,
      0.19543950758485482,
      -0.5116672736016927,
      -0.5116672736016927,
      0.19543950758485468
    ],
    [
      0.0,
      0.6015009550075456,
      0.37174803446018456,
      -0.37174803446018445,
      -0.6015009550075457
    ],
    [
      0.4472135954999579,
      0.4472135954999579,
      0.4472135954999579,
      0.4472135954999579,
      0.4472135954999579
    ]
  ],
  "P_perp": [
    [
      0.6324555320336759,
      -0.5116672736016927,
      0.19543950758485468,
      0.19543950758485498,
      -0.511667273601693
    ],
    [
      0.0,
      0.37174803446018456,
      -0.6015009550075457,
      0.6015009550075456,
      -0.3717480344601843
    ]
  ],
  "kind": "canonical_c5_real_dft",
  "schema_version": "1.0.0"
}
